<?xml version="1.0" encoding="gb2312"?>
<book isbn="0-764-58007-8" xsi:type="http://www.w3.org/2001/XMLSchema-instance" xsi:noNamespaceSchemaLocation="Book.xsd">
	<title>三国演义</title>
	<author>罗贯中</author>
	<price>80.00</price>
	<resume>滚滚长江东逝水，浪花淘尽英雄。是非成败转头空：青山依旧在，几度夕阳红。白发渔樵江渚上，惯看秋月春风。一壶浊酒喜相逢：古今多少事，都付笑谈中。</resume>
	<recommendation>经典好书</recommendation>
	<publish>
		<publisher>文艺出版社</publisher>
		
	<!--<pubdate>1998-10-29</pubdate>-->
	</publish>
</book>
